{
  "schema_version": "0",
  "dataset_id": "rc_missing_data_2026_03_03_b1_insertion_loss",
  "kind": "pic_component_measurements",
  "title": "rc_missing_data_2026_03_03 insertion-loss measurements template",
  "created_at": "2026-03-03T12:43:26.290017Z",
  "license": "Internal-Use-Only",
  "share_level": "private",
  "restrictions": {
    "contains_personal_data": false,
    "contains_export_controlled": false,
    "contains_proprietary": true,
    "notes": "Synthetic template starter rows; replace with measured silicon values before release evidence use."
  },
  "provenance": {
    "description": "Template measurement bundle for PIC Gate B correlation workflow."
  },
  "links": {
    "calibration_bundle_id": null,
    "graph_id": null,
    "config_hash": null
  },
  "files": [
    {
      "path": "data/insertion_loss_measurements.csv",
      "sha256": "22d60bd86ec032825c0d8132c8126242d60dfc8d6cc7bc61878adb015e769e39",
      "content_type": "text/csv",
      "description": "Insertion-loss measured vs model values for Gate B1."
    }
  ]
}
