{
  "schema_version": "0",
  "dataset_id": "meas_pic_xt_synth_001",
  "kind": "pic_crosstalk_sweep",
  "title": "Synthetic PIC crosstalk sweep (for calibration gates)",
  "created_at": "2026-02-13T00:00:00Z",
  "license": "CC-BY-4.0",
  "share_level": "public",
  "restrictions": {
    "contains_personal_data": false,
    "contains_export_controlled": false,
    "contains_proprietary": false,
    "notes": "Synthetic demo data for unit tests and drift gates."
  },
  "provenance": {
    "description": "Synthetic sweep generated from the v0 predictor for deterministic calibration tests."
  },
  "links": {
    "config_hash": null,
    "graph_id": null,
    "calibration_bundle_id": null
  },
  "files": [
    {
      "path": "data/pic_crosstalk_sweep.json",
      "sha256": "1c76543b4d66acc5f66005d00633d992d24e22284b7b1d3cb1a93c34a513c7e5",
      "content_type": "application/json",
      "description": "Synthetic crosstalk sweep table."
    }
  ]
}

