{
  "schema_version": "0",
  "dataset_id": "rc_missing_data_2026_03_03_b2_resonance",
  "kind": "pic_resonance_measurements",
  "title": "rc_missing_data_2026_03_03 resonance measurements template",
  "created_at": "2026-03-03T12:43:26.292049Z",
  "license": "Internal-Use-Only",
  "share_level": "private",
  "restrictions": {
    "contains_personal_data": false,
    "contains_export_controlled": false,
    "contains_proprietary": true,
    "notes": "Synthetic template starter rows; replace with measured silicon values before release evidence use."
  },
  "provenance": {
    "description": "Template measurement bundle for PIC Gate B correlation workflow."
  },
  "links": {
    "calibration_bundle_id": null,
    "graph_id": null,
    "config_hash": null
  },
  "files": [
    {
      "path": "data/resonance_measurements.csv",
      "sha256": "ac62f68ca72c43484b2cb375e4f7bc257e6cc373ff06c56ba01f5fe60e9e4cce",
      "content_type": "text/csv",
      "description": "Resonance center measured vs model values for Gate B2."
    }
  ]
}
